[
  {
    "id": "d1-001",
    "domain": 1,
    "domain_name": "Agentic Architecture & Orchestration",
    "front": "What loop do agentic applications run?",
    "back": "They run an observe-reason-act-observe loop: the model sees current context, chooses a tool or response, incorporates results, and continues until the task is done or blocked.",
    "difficulty": "easy",
    "tags": [
      "agentic-loop",
      "observe-act"
    ]
  },
  {
    "id": "d1-002",
    "domain": 1,
    "domain_name": "Agentic Architecture & Orchestration",
    "front": "Which agentic pattern fits a fixed three-stage code review (style, then security, then documentation)?",
    "back": "Prompt chaining, because the steps are known and fixed; chaining adds reliability by constraining the model to a known sequence.",
    "difficulty": "easy",
    "tags": [
      "prompt-chaining",
      "patterns"
    ]
  },
  {
    "id": "d1-003",
    "domain": 1,
    "domain_name": "Agentic Architecture & Orchestration",
    "front": "Which pattern fits routing invoices, receipts, and contracts to different extraction tools?",
    "back": "Routing: inputs fall into distinct handling categories, so you classify then dispatch to the right handler.",
    "difficulty": "easy",
    "tags": [
      "routing",
      "patterns"
    ]
  },
  {
    "id": "d1-004",
    "domain": 1,
    "domain_name": "Agentic Architecture & Orchestration",
    "front": "Which pattern fits debugging an intermittent backend failure where each finding changes the plan?",
    "back": "Dynamic decomposition, because the next step genuinely depends on what the model just learned; a fixed checklist would miss the actual cause.",
    "difficulty": "medium",
    "tags": [
      "dynamic-decomposition",
      "investigation"
    ]
  },
  {
    "id": "d1-005",
    "domain": 1,
    "domain_name": "Agentic Architecture & Orchestration",
    "front": "Which pattern fits a research coordinator that decides which specialist subagents to invoke?",
    "back": "Orchestrator-workers: a coordinator chooses and delegates subtasks rather than following a fixed chain.",
    "difficulty": "easy",
    "tags": [
      "orchestrator-workers",
      "patterns"
    ]
  },
  {
    "id": "d1-006",
    "domain": 1,
    "domain_name": "Agentic Architecture & Orchestration",
    "front": "When should you avoid the parallel-subagents pattern?",
    "back": "When workstreams depend on each other's results, when the partition would split a logical unit, or when sequential streaming output matters more than throughput.",
    "difficulty": "medium",
    "tags": [
      "parallel-subagents",
      "dependencies"
    ]
  },
  {
    "id": "d1-007",
    "domain": 1,
    "domain_name": "Agentic Architecture & Orchestration",
    "front": "A billing-dispute workflow always runs verify identity, fetch invoice, check policy, propose adjustment. Chaining or dynamic decomposition?",
    "back": "Prompt chaining: the steps are genuinely fixed, so chaining gives reliability and consistent outputs; dynamic decomposition would invite unnecessary tool calls.",
    "difficulty": "medium",
    "tags": [
      "prompt-chaining",
      "customer-service"
    ]
  },
  {
    "id": "d1-008",
    "domain": 1,
    "domain_name": "Agentic Architecture & Orchestration",
    "front": "A security incident triage must decide whether to pull logs, query a SIEM, page on-call, or all three. Which pattern?",
    "back": "Dynamic decomposition: the next move only becomes clear after the current finding, so a fixed chain would produce shallow analyses.",
    "difficulty": "medium",
    "tags": [
      "dynamic-decomposition",
      "triage"
    ]
  },
  {
    "id": "d1-009",
    "domain": 1,
    "domain_name": "Agentic Architecture & Orchestration",
    "front": "Why is the choice of agentic pattern framed as matching the shape of work rather than picking the best pattern?",
    "back": "Each pattern trades reliability against adaptability; chaining suits fixed steps while decomposition suits exploratory work, so the right one depends on the task structure.",
    "difficulty": "hard",
    "tags": [
      "patterns",
      "design-tradeoff"
    ]
  },
  {
    "id": "d1-010",
    "domain": 1,
    "domain_name": "Agentic Architecture & Orchestration",
    "front": "The user asks the coordinator to summarize three sentences it just retrieved. Delegate to a subagent or answer directly?",
    "back": "Answer directly: delegation adds a tool call, fresh context, separate invocation, and result passing; that overhead is wasteful when the coordinator already has the context and the work is small.",
    "difficulty": "medium",
    "tags": [
      "delegation",
      "overhead"
    ]
  },
  {
    "id": "d1-011",
    "domain": 1,
    "domain_name": "Agentic Architecture & Orchestration",
    "front": "Name three cases where delegating to a subagent is worthwhile despite its overhead.",
    "back": "When the task would flood the coordinator's context, when it needs a different prompt or tool set (specialist persona), or when it can run in parallel with other work.",
    "difficulty": "easy",
    "tags": [
      "delegation",
      "subagents"
    ]
  },
  {
    "id": "d1-012",
    "domain": 1,
    "domain_name": "Agentic Architecture & Orchestration",
    "front": "What is the partition-then-parallel pattern for auditing 50 repositories?",
    "back": "The coordinator divides the input into N roughly equal chunks, spawns N subagents (one per chunk), and synthesizes their uniform structured outputs.",
    "difficulty": "medium",
    "tags": [
      "partition-parallel",
      "subagents"
    ]
  },
  {
    "id": "d1-013",
    "domain": 1,
    "domain_name": "Agentic Architecture & Orchestration",
    "front": "In partition-then-parallel work, why balance partitions by expected effort, not raw count?",
    "back": "Total elapsed time becomes max(subagent_durations); if a few partitions are far heavier, the slowest one dictates total time and the parallelism is wasted.",
    "difficulty": "hard",
    "tags": [
      "parallel-execution",
      "load-balancing"
    ]
  },
  {
    "id": "d1-014",
    "domain": 1,
    "domain_name": "Agentic Architecture & Orchestration",
    "front": "Does a subagent automatically share the parent agent's conversation state?",
    "back": "No. A subagent starts a fresh conversation and sees only what the parent explicitly passes plus its own AgentDefinition; it does not see prior user turns, assistant turns, or tool results.",
    "difficulty": "easy",
    "tags": [
      "subagent-context",
      "isolation"
    ]
  },
  {
    "id": "d1-015",
    "domain": 1,
    "domain_name": "Agentic Architecture & Orchestration",
    "front": "Since subagents do not inherit context, what must the parent put in the subagent prompt?",
    "back": "Everything the subagent needs: the goal, relevant findings, constraints, source references, and the expected output shape.",
    "difficulty": "medium",
    "tags": [
      "subagent-context",
      "handoff"
    ]
  },
  {
    "id": "d1-016",
    "domain": 1,
    "domain_name": "Agentic Architecture & Orchestration",
    "front": "Why doesn't a \"resume the previous research subagent\" pattern exist by default?",
    "back": "Calling the Agent/Task tool again starts a brand-new agent; for continuity the parent must persist an identifier or include the prior summary in the new prompt.",
    "difficulty": "medium",
    "tags": [
      "subagent-context",
      "state"
    ]
  },
  {
    "id": "d1-017",
    "domain": 1,
    "domain_name": "Agentic Architecture & Orchestration",
    "front": "Critique the subagent handoff \"Synthesize the findings.\"",
    "back": "It is too vague; a good handoff specifies the records, requires preserving uncertainty, citing each claim with its source_id, and separating established from contested findings.",
    "difficulty": "medium",
    "tags": [
      "handoff",
      "provenance"
    ]
  },
  {
    "id": "d1-018",
    "domain": 1,
    "domain_name": "Agentic Architecture & Orchestration",
    "front": "For final report generation requiring citations, what should the coordinator pass to the report subagent?",
    "back": "A structured source index mapping claims to source IDs, URLs, excerpts, dates, and confidence/uncertainty notes - not only a prose summary.",
    "difficulty": "medium",
    "tags": [
      "report-generation",
      "provenance"
    ]
  },
  {
    "id": "d1-019",
    "domain": 1,
    "domain_name": "Agentic Architecture & Orchestration",
    "front": "Why shouldn't every subagent inherit every tool?",
    "back": "More tools increase selection complexity and can lead agents outside their role; restricting tools to what each subagent needs improves focus and security.",
    "difficulty": "easy",
    "tags": [
      "tool-distribution",
      "subagents"
    ]
  },
  {
    "id": "d1-020",
    "domain": 1,
    "domain_name": "Agentic Architecture & Orchestration",
    "front": "What tools does a synthesis subagent that should only work from supplied findings need?",
    "back": "Generally no external search tools; it should work only from the findings the coordinator passes so it does not introduce unsourced content.",
    "difficulty": "medium",
    "tags": [
      "tool-distribution",
      "synthesis"
    ]
  },
  {
    "id": "d1-021",
    "domain": 1,
    "domain_name": "Agentic Architecture & Orchestration",
    "front": "In the Claude Agent SDK, what must be in the parent's allowedTools for it to spawn subagents?",
    "back": "The delegation tool itself (typically named Task or Agent); without it the parent has no callable interface to launch the subagent definitions.",
    "difficulty": "medium",
    "tags": [
      "agent-sdk",
      "delegation"
    ]
  },
  {
    "id": "d1-022",
    "domain": 1,
    "domain_name": "Agentic Architecture & Orchestration",